Compétence Visée;Compétences Acquises;Méthode d'apprentissage;Niveau
Innovativ project;;;;
Analyse a real-life problem;+ Capable de cromprendre les enjeux derrière un problème|+ Capable d'identifier les différents acteurs et les bénificiaires si le problème est résolu|+ Capable de définir de façon plus formel un problème de la vie réelle;Formation Initiale;3;
Suggest a technological solution to a problem;+ Capable de faire des choix pertinant en matière de technologie en réfléchissant sur plusieurs problématiques comme l'optimisation de la solution, le coût, l'impact ecologique, l'impact sociologique et la sécurité;Formation Initiale + Pratique Professionnelle;4;
Implement a prototype to solve the problem;+ Capable de réaliser une preuve de concept en proposant un prototype démontrant la faisabilité de la solution définit;Formation Initiale;4;
Present and debate (in English) the technical choice made;+ Capable d'échanger avec des professionnelles du domaine en Anglais sur une longue période de temps|+ Capable de créer un argument structuré et clair en Anglais dans le but de convaincre;Formation Initiale + Pratique Professionnelle;4;
Produce a report (in English) for the developed project;+ Capable de produire un rapport en Anglais expliquant les aspects techniques et manageurials de mon projet;Formation Initiale;4;